{
  "schemaVersion": 2,
  "documentType": "workspacectl/config",
  "catalog": {
    "adapter": "file",
    "path": "/tmp/workspacectl-synthetic/catalog.json"
  },
  "localState": {
    "adapter": "file",
    "path": "/tmp/workspacectl-synthetic/local-state.json"
  },
  "plans": {
    "directory": "/tmp/workspacectl-synthetic/plans"
  },
  "trustedRoots": [
    "/tmp/workspacectl-synthetic/workspaces"
  ]
}
